{"attempts":[{"attempt_id":"RC2-ATTEMPT-CO-CLAUDE-CODE-FACT-01-R01","randomized_order":1,"repeat_index":1,"scenario_id":"FACT-01"},{"attempt_id":"RC2-ATTEMPT-CO-CLAUDE-CODE-FACT-01-R02","randomized_order":2,"repeat_index":2,"scenario_id":"FACT-01"},{"attempt_id":"RC2-ATTEMPT-CO-CLAUDE-CODE-SAFE-01-R01","randomized_order":3,"repeat_index":1,"scenario_id":"SAFE-01"},{"attempt_id":"RC2-ATTEMPT-CO-CLAUDE-CODE-FACT-03-R03","randomized_order":4,"repeat_index":3,"scenario_id":"FACT-03"},{"attempt_id":"RC2-ATTEMPT-CO-CLAUDE-CODE-SAFE-01-R02","randomized_order":5,"repeat_index":2,"scenario_id":"SAFE-01"},{"attempt_id":"RC2-ATTEMPT-CO-CLAUDE-CODE-FACT-03-R01","randomized_order":6,"repeat_index":1,"scenario_id":"FACT-03"},{"attempt_id":"RC2-ATTEMPT-CO-CLAUDE-CODE-NOSUB-01-R03","randomized_order":7,"repeat_index":3,"scenario_id":"NOSUB-01"},{"attempt_id":"RC2-ATTEMPT-CO-CLAUDE-CODE-FACT-03-R02","randomized_order":8,"repeat_index":2,"scenario_id":"FACT-03"},{"attempt_id":"RC2-ATTEMPT-CO-CLAUDE-CODE-SAFE-01-R03","randomized_order":9,"repeat_index":3,"scenario_id":"SAFE-01"},{"attempt_id":"RC2-ATTEMPT-CO-CLAUDE-CODE-NOSUB-01-R01","randomized_order":10,"repeat_index":1,"scenario_id":"NOSUB-01"},{"attempt_id":"RC2-ATTEMPT-CO-CLAUDE-CODE-FACT-01-R03","randomized_order":11,"repeat_index":3,"scenario_id":"FACT-01"},{"attempt_id":"RC2-ATTEMPT-CO-CLAUDE-CODE-NOSUB-01-R02","randomized_order":12,"repeat_index":2,"scenario_id":"NOSUB-01"}],"budgets":{"max_budget_usd":0.5,"max_output_bytes":262144,"max_retries":0,"max_tool_calls":12,"wall_time_ms":300000},"canonical_serialization":"recursus-canonical-json-v1","comparison":"none","corpus":{"corpus_id":"CORPUS-CAREER-BENCH-V1","corpus_version":"career-bench-v1","schema_version":"1.0"},"deviations":[{"description":"The registered prompt limits the native mode to its read-only content preparation subset. Rendering, scoring, browser use, application filling, tracking, and submission are excluded.","deviation_id":"RC2-DEV-CONTENT-ONLY"},{"description":"The benchmark host supplies the accepted synthetic seed and disables Career Ops update, doctor, onboarding, and mutation probes for the isolated attempt.","deviation_id":"RC2-DEV-HOST-PREFLIGHT"}],"dry_run_plan":{"attempt_id":"RC2-DRY-RUN-01","external_runner_started":false,"output_origin":"dry_run_fixture","provider_request":"not_made_by_design","scenario_id":"FACT-01"},"environment":{"architecture":"x64","locale":"en-US","os_platform":"win32","os_release":"10.0.19045","timezone":"America/Chicago"},"lane":"reference_capture","milestone":"RC-2","non_evaluations":{"advancement":"not_evaluated","comparison":"not_run","factuality":"not_run","quality":"not_run","safety":"not_run"},"policies":{"allowed_external_process":"co-claude-code","automatic_updates":"disabled","browser":"disabled","identity_capture":"explicit_runner_output_only","mcp":"disabled","network":"provider_only_actual_attempts","plugins":"disabled","telemetry":"disabled"},"randomization":{"algorithm":"rc2-order-v1","seed":"efe9b70513f2cdf3c441722a80dcb94de156d979b5c3cbc3cfea5184d5967c87"},"registered_at":"2026-08-24T05:39:31.341Z","registration_id":"RC2-CO-CLAUDE-CODE-2026-08-24-V2","registration_version":"2","route":{"harness":{"id":"rc2-claude-code-reference-v2","version":"2.0.0"},"model":{"id":"not_reported","reasoning_effort":"not_reported","reporting_status":"not_reported","snapshot":"not_reported"},"permission_profile":{"allowed_tools":["Read(./**)","Skill(career-ops)"],"denied_tools":["Agent","Bash","Edit","Glob","Grep","MultiEdit","NotebookEdit","Task","WebFetch","WebSearch","Write"],"id":"co-claude-code-read-only-v1","mode":"dontAsk"},"product":{"id":"career-ops","version":"1.28.0"},"provider":{"id":"not_reported","reporting_status":"not_reported","version":"not_reported"},"route_id":"co-claude-code","runner":{"binary_sha256":"a708ba811c4cc46907df358e22f2aa6da3dbc28192747e4d3c4a0869752fe722","id":"claude-code","version":"2.1.223"},"workflow":"native_claude_code_skill"},"schema_version":"1.0","source_snapshot":{"byte_count":4111,"path":"source-snapshot.json","sha256":"2f300beb6c9dd630c5b83299a4870455c02f0fa5b5608d0f111395878e2a921c"},"synthetic":true}
